<?xml version="1.0" encoding="UTF-8"?><settings xmlns="http://hak.pp.ua/settingsSchema" xmlns:xsi="http://www.w3.org/2001/XMLSchema-instance" xsi:schemaLocation="http://hak.pp.ua/settingsSchema settingsSchema.xsd"><font><name>Consolas</name><style>0</style><size>14</size></font><foreground><color>-16777216</color></foreground><background><color>-1</color></background><wordwrap><enable>true</enable></wordwrap><statusbar><enable>true</enable></statusbar><parserpanel><enable>true</enable></parserpanel></settings>